{
  "v": 1,
  "cue_id": "cue_5521",
  "t_start_ms": 1893500,
  "duration_ms": 6000,
  "region": "lower_third",
  "priority": 2,
  "persona": "casual",
  "lang": "es",
  "payload": {
    "type": "insight_card",
    "text_ids": ["t_ES_88"],
    "claims": ["c_91a7"]
  },
  "credential": {
    "verdict_ref": "v_0a1b",
    "status": "confirmed",
    "receipt": "c2NpdHQ"
  }
}
